name,region,variety,rating,notes
Eroica 1998 Single Berry Select 1997,"Columbia Valley, Washington",White Wine,98.0,"""Breathtaking in its richness and power, yet balanced against a lacy web of acidity that keeps the sticky, syrupy textures from going over the top. Flavors of apricot, baked apple, dried pineapple and tropical fruit last and last. Drink now through 2020. 100 cases made. (HS)"""
Escarpment Kupe Pinot Noir 2015,"Martinborough, New Zealand",Red Wine,96.0,"This is the eleventh release from The Escarpment Vineyard’s close planted vineyard on Te Muna Road, Martinborough. "
Espectacle Espectacle del Montsant (1.5L Magnum) 2010,Spain,Red Wine,98.0,"Moderately intense red color with purple hues. The aroma, at first appears to be closed; immidiately seduces with an unusual complexity and intensity. Initially stands a background of ripe black fruit wrapped in hardwood. As air reaches the wine, it's scent completely changes to a citric orange and floral notes that are so characteristic for this unique wine. The rose and the orange blossom fill the glass with a surprising exuberance. On the palate is it opulent, seductive and highly persistant. As in previous years, it's high concentration relies on the aroma and not on a great tannic structure. It's a wine that grows on the palate as the seconds pass. Yet another year, this wine reflects the formidable personality of centenary vines from an unmistakable region."
Espectacle Espectacle del Montsant 2006,Spain,Red Wine,96.0,"This outstanding new wine comes from a single, very steep vineyard planted with over 100 year old Grenache vines. The vineyard is located at La Figuera, on the northern edge of the Montsant D.O., and looks onto the famous Montsant mountain as well as having spectacular views of the Ebro valley and even the distant Pyrenees 200 kms away. Hence the name!"
Espectacle Espectacle del Montsant 2010,Spain,Red Wine,98.0,"Moderately intense red color with purple hues. The aroma, at first appears to be closed; immidiately seduces with an unusual complexity and intensity. Initially stands a background of ripe black fruit wrapped in hardwood. As air reaches the wine, it's scent completely changes to a citric orange and floral notes that are so characteristic for this unique wine. The rose and the orange blossom fill the glass with a surprising exuberance. On the palate is it opulent, seductive and highly persistant. As in previous years, it's high concentration relies on the aroma and not on a great tannic structure. It's a wine that grows on the palate as the seconds pass. Yet another year, this wine reflects the formidable personality of centenary vines from an unmistakable region."
Espectacle Espectacle del Montsant 2012,Spain,Red Wine,99.0,"Its color is surprisingly intense compared to previous vintages. Bright, airy and deep, it delights us with a lush appearance in which clear violet notes on a ruby background can be distinguished. The wine initially evokes notes of red fruits on a well defined floral background. Rose and violet notes quickly appear. These are surrounded by increasing complexity in which cocoa and cassis are clearly distinguished. Gradually, as it aerates, the wine's aroma expands and characteristic notes of orange blossom appear. In the month it is opulent and very unctuous. Almost immediately its intense, agreeable texture caresses the palate giving very pleasant sensations and leaving us with a pleasant and long finish."
Espectacle Montsant 2013,"Montsant, Spain",Red Wine,96.0,"Its color is surprisingly intense compared to previous vintages. Bright, airy and deep, it delights us with a lush appearance in which clear violet notes on a ruby background can be distinguished. The wine initially evokes notes of red fruits on a well defined floral background. Rose and violet notes quickly appear. These are surrounded by increasing complexity in which cocoa and cassis are clearly distinguished. Gradually, as it aerates, the wine's aroma expands and characteristic notes of orange blossom appear. In the month it is opulent and very unctuous. Almost immediately its intense, agreeable texture caresses the palate giving very pleasant sensations and leaving us with a pleasant and long finish."
Espectacle Montsant 2014,"Montsant, Spain",Red Wine,97.0,"Its color is surprisingly intense compared to previous vintages. Bright, airy and deep, it delights us with a lush appearance in which clear violet notes on a ruby background can be distinguished. The wine initially evokes notes of red fruits on a well defined floral background. Rose and violet notes quickly appear. These are surrounded by increasing complexity in which cocoa and cassis are clearly distinguished. Gradually, as it aerates, the wine's aroma expands and characteristic notes of orange blossom appear. In the month it is opulent and very unctuous. Almost immediately its intense, agreeable texture caresses the palate giving very pleasant sensations and leaving us with a pleasant and long finish."
Evening Land Seven Springs Vineyard La Source Chardonnay 2012,"Eola-Amity Hills, Willamette Valley, Oregon",White Wine,96.0,#3
Evening Land Seven Springs Vineyard La Source Pinot Noir 2012,"Eola-Amity Hills, Willamette Valley, Oregon",Red Wine,98.0,#3 
Evening Land Seven Springs Vineyard Pinot Noir 2012,"Eola-Amity Hills, Willamette Valley, Oregon",Red Wine,96.0,"This wine is a deep garnet in color with a ruby edge. Thenose is dominated with freshly picked blackberries, toastedalmonds, baking spice and hints of citrus. The palate ispleasantly balanced, shows soft tannins and notes of freshlymade grenadine. The finish is endless and expresses beautifulminerality, a lingering acidity, and perseverant fruit that allundeniably and characteristically come from the Seven Springs Estate."
Eyrie Estate Chardonnay 2014,"Willamette Valley, Oregon",White Wine,96.0,"The wines are subtly expressive, elegant, and long-lived."
Failla Hirsch Vineyard Pinot Noir 2010,"Sonoma County, California",Red Wine,97.0,"Aromatics of the Hirsch Vineyard Pinot Noir 2010 are quintessential Hirsch; expressive with raspberry, green tea, sandalwood and balsam. The palate shows the noble side of Pinot Noir; fine but resolved tannins that give way to great freshness as a result of the well preserved acidity."
Failla Occidental Ridge Vineyard Pinot Noir 2010,"Sonoma County, California",Red Wine,97.0,"2010 brought out more of Occidental's savory side with aromatics of maple syrup, pecan, and sassafras. Brighter on the palate this vintage, with a juicy mouthfeel balanced by acidity and resolved firm tannins."
Famille Perrin Gigondas l'Argnee Vieilles Vignes 2012,"Gigondas, Rhone, France",Red Wine,97.0,"This wine gets its exceptional aromas from vines spanning less than 1 hectare, with nearly 100 years in age."
Far Niente Cabernet Sauvignon 2005,"Oakville, Napa Valley, California",Red Wine,96.0,"Notes of dense black fruit, anise and blackberries appear up front followed by hints of fruit jam and dark chocolate. In the mouth, this wine unfolds in layers, beginning with a round and supple entry and progressing to a full, weighty structure on the palate. The silky tannins are textured and coating, producing a wine that is smooth from start to finish."
Fattoria Le Pupille Elisabetta Geppetti Saffredi (1.5 Liter Magnum) 2013,"Tuscany, Italy",Red Wine,98.0,"Rich garnet red in color, with an opulent bouquet of black plums, cassis, cedar spice, and violet this wine exudes pedigree. Warm and luscious, the fruit expands on the palate as the well-integrated tannins fill the mouth.  Long and lingering the finish is unforgettable."
Fattoria Le Pupille Elisabetta Geppetti Saffredi (1.5 Liter Magnum) 2017,"Tuscany, Italy",Red Wine,97.0,"Deep ruby color with purple reflections. It shows pronounced flavors of black fruits like blackcurrant and black cherry along with spicy aromas of cloves, cinnamon and licorice. The palate has a generous velvety texture with round tannins and a return of the fruit for a long and persistent finish."
Fattoria Le Pupille Elisabetta Geppetti Saffredi 2013,"Tuscany, Italy",Red Wine,98.0,"Rich garnet red in color, with an opulent bouquet of black plums, cassis, cedar spice, and violet this wine exudes pedigree. Warm and luscious, the fruit expands on the palate as the well-integrated tannins fill the mouth.  Long and lingering the finish is unforgettable."
Fattoria Le Pupille Elisabetta Geppetti Saffredi 2017,"Tuscany, Italy",Red Wine,97.0,"Deep ruby color with purple reflections. It shows pronounced flavors of black fruits like blackcurrant and black cherry along with spicy aromas of cloves, cinnamon and licorice. The palate has a generous velvety texture with round tannins and a return of the fruit for a long and persistent finish."
FEL Savoy Vineyard Pinot Noir 2015,"Anderson Valley, Mendocino, California",Red Wine,97.0,"Aromatic waves of black cherry, pomegranate, and boysenberry fill the glass of this elegantly concentrated wine. Subtle notes of anise, black tea leaves, and redwood needles add further depth and complexity to the nose. The weight and concentration of this heady wine is immediately apparent in the mouth, with dense layers of black fruit, pencil shavings, and hints of cocoa. The velvet-like tannins provide structure that is punctuated by a refreshingly acidic finish that lingers in the mouth for several minutes. This wine will age gracefully for a full decade or more. "
Felsina Chianti Classico Riserva Rancia (1.5 Liter Magnum) 2006,"Chianti Classico, Chianti, Tuscany, Italy",Red Wine,96.0,"Brilliant, rich ruby red. Spicy nose with floral notes and wild berry nuances. Spice continues in the mouth, nicely complemented by a dense, soft fabric of youthful tannins; excellent structure and superb overall character."
Felsina Maestro Raro Cabernet Sauvignon 2016,"Tuscany, Italy",Red Wine,97.0,"The grapes come from the vineyards Rancia Piccola and Poggiolo, the first also called Mastro Raro, adjacent and similar to that of Rancia. The best-known and most wydely-planted red grape in the world, Cabernet Sauvignon, was planted here, right in the locus of the Felsina terroir at its most classic. First vintage 1987. "
Ferrari Giulio Ferrari Riserva del Fondatore 2006,"Trentino, Trentino-Alto Adige, Italy",Sparkling & Champagne,97.0,"It presents itself in the glass with a glowing golden hue, highlighted by extremely fine, persistent bubbles. The bouquet displays an incredible succession of sensations that continue to alternate, ranging from citrus zest to creamy eggnog, from mango to sugared almonds, and from acacia blossom to freshly baked brioche, all underpinned by an enticing hint of iodine. The entry on the palate is sumptuous in its unbridled elegance and light in its incredibly concentrated fruitiness, which offers reminiscences of ripe pineapple, dried fruits and toasted hazelnuts. The finish is very refined, revealing lingering brackish notes that give even greater length to the aftertaste."
Ferrer Bobet 2008,"Priorat, Spain",Red Wine,96.0,"Ferrer Bobet is primarily a blend of Carignane and Grenache, from hundred year old vines in some of the best vineyards in Priorat, sourced while their own vineyards mature. Though the ""second wine"" of Ferrer Bobet, the initial 2005 release put Ferrer Bobet on the wine world map. It launched the Ferrer Bobet mission of creating wines of elegance and purity, and the message has resonated."
Figgins Estate Red Wine 2010,"Walla Walla Valley, Columbia Valley, Washington",Red Wine,97.0,"Intoxicating aromas of cinnamon, dried flowers, baking spices, and blackberry puree. Not as immediately sexy and appealing as the voluptuous 2009 but exhibiting all of the same charactersitics of Figgins Estate Vineyard with more classic structured backbone and long term attractiveness.. This vintage shows amazing purity of fruit and aromatics, balanced by the structure and acidity of a cool vintage, with an immaculate finish to both the weather and the wine."
Flora Springs Rutherford Hillside Reserve Cabernet Sauvignon 1994,"Napa Valley, California",Red Wine,96.0,"This wine is absolutely delicious with ripe, luscious fruit that wraps around the tannins. It is a seductive wine with vibrant aromas and flavors of jammy blackberries, spice, black currants, vanilla and black licorice."
Flowers Sea View Ridge Pinot Noir 2010,"Sonoma County, California",Red Wine,98.0,"Deep vibrant red color. Delicate floral notes of rose petal and bergamot combine with hints of forest floor, earth and ripe cherry. Flavors emerge with raspberry, red current and dried cherry with hints of graphite and other minerals. The wine's texture is elegant and smooth across the palate with an enduring finish."
Flowers Sea View Ridge Pinot Noir 2014,"Sonoma Coast, Sonoma County, California",Red Wine,96.0,"Deep garnet core. is wine is deceptively elegant and complex with aromas of rhubarb, Bing cherry, pomegranate and blood orange mingling with talc, white pepper, and redwood spice. On the palate are darker berry fruits with orange zest and savory notes. Well-integrated silky tannins and brilliant acidity, this wine unfolds in the glass with layers and nuance. Made with 100% Pinot Noir."
Fonseca Vintage Port 1963,Portugal,Collectible,96.0,"Rich full ruby center, tawny highlights.  A wine in total harmony on the bouquet.  The nose overflows with aromas of cured leather, warm marmalade, cinnamon, scented rosewood.  Pungent, fat, rounded; oodles of volume on the nose. Then wonderful pear drop lift on the finish.  "
Fonseca Vintage Port 1992,Portugal,Collectible,97.0,"Fonseca vintage ports are renowned for their great fruit richness and voluptuousness, and, while powerful and mouthfilling, for their breed and balance.  In the context of each vintage, they combine the tannic dimension and grip which give great port its longevity with the structure and complexity that are Fonsecas hallmark."
Fonseca Vintage Port 1994,Portugal,Collectible,97.0,"Dark red, ruby edge. Dense blackcurrant fruit, very fresh and elegant, incredible balance of fine fruit and the first hints of bottle maturity. On the palate it is very full, with lots of fine tannins which carry loads of fresh blackcurrant fruit. The youth it still holds today is the testament of how extraordinary this vintage is, and the capacity it has to continue to age for the rest of this century."
Fontodi Flaccianello della Pieve 2015,"Tuscany, Italy",Red Wine,96.0,Flaccianello combines all the wild and old-world characteristics of the Sangiovese grape with the modern vinification techniques of what may be the top winemaking house in Tuscany today. The vineyards from which this wine takes its name continues to produce a Sangiovese of superior quality year on year. Made with 100% Sangiovese.
Forjas del Salnes Leirana Finca Genoveva Albarino 2018,"Rias Baixas, Spain",White Wine,96.0,"Brilliant straw-yellow. Fresh quince, tangerine and lemongrass on the intensely perfumed nose, which is complicated by floral and quinine nuances that build with air. Shows impressive nerve and mineral lift on the palate, offering vibrant citrus and orchard fruit flavors and a suave floral nuance. Finishes taut, racy and very long, displaying superb focus and an echo of florality. "
Fox Creek Reserve Shiraz 1998,Australia,Red Wine,96.0,Powerful blackberries and blackcurrant flavors together with licorice and dark chocolate. These flavors are balanced by firm acidity and fully integrated tannin giving a wine of extraordinary depth and length of finish. This is the epitome of Fox Creek's Reserve Shiraz style.
Frederic Esmonin Ruchottes-Chambertin Grand Cru (1.5 Liter Magnum) 2016,"Gevrey-Chambertin, Cote de Nuits, Cote d'Or, Burgundy, France",Red Wine,96.0,"Ruchottes is a very small Grand Cru, divided into three lieu-dits: Ruchottes du Dessus, Clos des Ruchottes and Ruchottes du Bas, which sits directly above Mazy-Chambertin Haut. The top sections of the Ruchottes are quite steep, with very shallow, and very poor topsoil due to erosion, whereas the lower sections are not quite as infertile. The wines from Ruchottes tend to be characterized as being more structured than other grand crus, but in reality they are finely fruited and more detailed, causing them to appear to be more structured than wines with a heavier fruit profile. The 60 year old vines work their way through the fractured Premeaux and Oolite limestone which lies just beneath the surface. Some Pinot Beurrot in this parcel gives the wine an added measure ofgras, notes Frédéric Esmonin” (Tanzer 2/2016)."
Frederic Esmonin Ruchottes-Chambertin Grand Cru (3 Liter) 2016,"Gevrey-Chambertin, Cote de Nuits, Cote d'Or, Burgundy, France",Red Wine,96.0,"Ruchottes is a very small Grand Cru, divided into three lieu-dits: Ruchottes du Dessus, Clos des Ruchottes and Ruchottes du Bas, which sits directly above Mazy-Chambertin Haut. The top sections of the Ruchottes are quite steep, with very shallow, and very poor topsoil due to erosion, whereas the lower sections are not quite as infertile. The wines from Ruchottes tend to be characterized as being more structured than other grand crus, but in reality they are finely fruited and more detailed, causing them to appear to be more structured than wines with a heavier fruit profile. The 60 year old vines work their way through the fractured Premeaux and Oolite limestone which lies just beneath the surface. Some Pinot Beurrot in this parcel gives the wine an added measure ofgras, notes Frédéric Esmonin” (Tanzer 2/2016)."
Freeman Keefer Ranch Pinot Noir 2008,"Russian River, Sonoma County, California",Red Wine,96.0,"The 2008 Freeman Keefer Ranch Pinot Noir is reminiscent of the soft and fruity 2007 version. There's a beautiful nose of rhubarb, black cherries, spicy oak and cola that seems to change every time you pick up the glass. On the palate, the texture is seductive with perfect acidity and very pleasant cranberry and cherry flavors. The finish is long with toasty oak and fruit. We anticipate the best drinking window to be from 2011 to 2015 for the '08 Freeman Keefer. "
Freemark Abbey Bosche Cabernet Sauvignon 2012,"Rutherford, Napa Valley, California",Red Wine,97.0,"Dark ruby in color, the 2012 Bosché has sweet black cherry aroma with integrated oak spice and black fruits. The complexity in the nose expresses green olive, aromatic cedar, walnut meat, mushroom and dark chocolate. The flavor is big, voluptuous, soft and velvety, with rich great depth of black fruit. The tannins are well integrated providing a very long fruitful finish."
Freemark Abbey Bosche Cabernet Sauvignon 2014,"Rutherford, Napa Valley, California",Red Wine,96.0,"Very dark (opaque) ruby in color, the 2014 Bosché has a rich, dusty blackberry and cassis aroma, with immense depth and complexity. The sweet oak spice is well integrated with spice nuances of cinnamon, clove, aromatic cedar, black pepper, and dark cocoa powder. The flavor is big, voluptuous, soft, and velvety, with rich great depth of black fruit. With balanced acidity, good body, and texture, the tannins are well integrated providing a very long fruitful finish."
Freemark Abbey Sycamore Cabernet Sauvignon 2015,"Rutherford, Napa Valley, California",Red Wine,97.0,"This opaque dark ruby wine has aromas of black currant and blueberry, with nuances of blackberry jam on toast, dark chocolate truffle, and forest floor. The oak adds the right amount of complexity with aromatic cedar, cinnamon, and clove. The wine has a great depth of black fruit flavor, with a strong expression of sweet black cherry and dark plum. There is a complexity in the nose that hints of tobacco, Mexican spice, and a briary thicket. This full-bodied cabernet sauvignon has expressive tannin, and, with good acidity, shows great aging potential. "
Frescobaldi Castelgiocondo Brunello di Montalcino 1997,"Montalcino, Tuscany, Italy",Red Wine,96.0,"CastelGiocondo Brunello di Montalcino presents a clear ruby red with garnet highlights. Pronounced notes of blackberry elegantly accompanied by floral notes such as violet. The nose is complex and well-blended: spicy notes of black pepper and clove, tobacco and leather, and ""jus de viande"" reflect well the evolution of the wine. Resonating tannin textures, mellow structure with a long and elegant finish."
Frescobaldi Castelgiocondo Brunello di Montalcino Riserva 1999,"Montalcino, Tuscany, Italy",Red Wine,97.0,"A generous, multi-layered aromatic spectrum, veined with crisp nuances of menthol, followed by clean-edged fragrances of dark red berries, in particular blackberry and blueberry. Last to emerge are notes of rich spice, where elegant hints of black pepper and cinnamon predominate, capped by pungent tobacco leaf.  "
Frescobaldi Castelgiocondo Brunello di Montalcino Ripe di Convento Riserva 2012,"Montalcino, Tuscany, Italy",Red Wine,96.0," Intense and brilliant ruby red in colour, the wine is complex and intense on the nose: aromatic expression is of alternating notes of red and black fruits, damson and blackcurrant, before giving way to mineral notes of spice and incense. On the palate Ripe al Convento is opulent, enveloping, harmonious and rich with elegant tannins balanced by excellent flavour and acidity. The finish is persistent, lingering and aromatic."
Frescobaldi Castiglioni Giramonte 2006,"Tuscany, Italy",Red Wine,97.0,"Giramonte is Tenuta di Castiglioni's single-vineyard cru, produced in limited quantities from merlot and sangiovese. A purple-rimmed ruby red, so intense as to be almost opaque. Intense aromas of wild cherry and blackberry, both fresh-picked and as preserves, in addition to roasted hazelnuts, espresso beans, chocolate, vanilla, and cocoa butter, with spicy impressions of clove. Rich and smooth in the mouth, with an emphatic suite of smooth, velvety tannins and very lengthy development and finish."
Fuligni Brunello di Montalcino Riserva 2001,"Montalcino, Tuscany, Italy",Red Wine,97.0,"Only made in the finest years, the Fuligni Brunello di Montalcino Riserva shows remarkable elegance and complexity, and a beautiful bouquet of marasca cherries, tobacco and mint, with a lovely, long finish."
Futo (1.5 Liter Magnum) 2007,"Napa Valley, California",Red Wine,97.0,FUTO is the culmination of our efforts to produce the finest Cabernet-based blend possible from our estate vineyards. In making FUTO we strive for a balance of complexity and focus. We believe the wine should display power while retaining the site-specific characteristics that make the wine unique. 
Futo 2007,"Oakville, Napa Valley, California",Red Wine,97.0,FUTO is the culmination of our efforts to produce the finest Cabernet-based blend possible from our estate vineyards. In making FUTO we strive for a balance of complexity and focus. We believe the wine should display power while retaining the site-specific characteristics that make the wine unique.
Futo 2011,"Oakville, Napa Valley, California",Red Wine,97.0,"This wine’s aroma has it all: plums, incense, tobacco leaf, violets, and exotic spices. Zero racking and extended lees contact has given the 2011 FUTO a satisfying balance of creamy richness and superb freshness. Generous and inviting flavors of black-skinned fruits, cappuccino, citrus and cloves work in harmony with the sweet tannin and well integrated oak. While texturally approachable now, the inner density and complexity of this wine will continue to unfold with cellar age."
Futo 2013,"Oakville, Napa Valley, California",Red Wine,98.0,"A complex wine from a complex estate. The FUTO Oakville Estate Red Wine finds its feet with rich, sumptuous Cabernet Sauvignon but leans heavily on Cabernet Franc for poise and finesse. Petit Verdot is layered in for good measure."
Futo 5500 Cabernet Sauvignon 2014,"Stags Leap District, Napa Valley, California",Red Wine,96.0,"The 2014 FUTO 5500 is as clear as a bell. Vivid aromatics of cherry blossom, raspberry and currents, and a beguiling note of alpine herbs combine in a plush yet dense center. In addition to all this freshness is an almost glaze-like layer that provides an explosive backdrop to the contoured finish. The power, purity, and personality of this vintage will provide a thrill ride young or old.  Blend: 95% Cabernet Sauvignon, 5% Merlot."
Futo Cabernet Sauvignon 5500 (1.5 Liter Magnum) 2013,"Oakville, Napa Valley, California",Red Wine,98.0,"An opulent wine with saturated purple color. Pure aromas of black cassis, kirsch, mulberry and violets. A wine of great intensity and presence, but freshness and precision. The oak is nearly all concealed by the fruit which is penetrating and supported by powdery tannins and perfect acidic tension. The finish is complex with an added mineral stain leaving no doubt this wine has the reserves to age for decades."
Futo Cabernet Sauvignon 5500 2012,"Stags Leap District, Napa Valley, California",Red Wine,99.0,"An opulent wine with saturated purple color. Pure aromas of black cassis, kirsch, mulberry and violets. A wine of great intensity and presence, but freshness and precision. The oak is nearly all concealed by the fruit which is penetrating and supported by powdery tannins and perfect acidic tension. The finish is complex with an added mineral stain leaving no doubt this wine has the reserves to age for decades."
Futo Cabernet Sauvignon 5500 2013,"Oakville, Napa Valley, California",Red Wine,98.0,"An opulent wine with saturated purple color. Pure aromas of black cassis, kirsch, mulberry and violets. A wine of great intensity and presence, but freshness and precision. The oak is nearly all concealed by the fruit which is penetrating and supported by powdery tannins and perfect acidic tension. The finish is complex with an added mineral stain leaving no doubt this wine has the reserves to age for decades."
